Title,Authors,DOI,DOI link,Venue,Citation count,Year,Filename,Data source,"Supporting quotes for ""Data source""","Supporting  tables for ""Data source""","Reasoning for ""Data source"""
Artificial light at night affects brain plasticity and melatonin in birds,"Stan Moaraf, Yulia Vistoropsky, Tatyana Pozner, Rachel Heiblum, Monika Okuliarová, Michal Zeman, Anat Barnea",-,-,Neuroscience Letters,49,2019,Moaraf_2019.pdf,Figure 5,"  - ""We measured MEL plasma concentrations during midday and during the nights before and during exposure to ALAN, and the results are summarized in Fig. 5""
  - ""Plasma MEL concentrations were measured by direct radioimmunoassay [41], which has been validated for zebra finches [42].""
  - ""MEL levels were measured by sensitive radioimmunoassay and the concentrations recorded in our control group are comparable to previously published data [63].""
  - ""In all groups that were exposed to ALAN, MEL levels during the night were lower compared to the control group that was exposed to dark nights.""
  - ""Our results demonstrate that a diurnal avian species, which inhabits subtropical dry habitats and is exposed to high light levels during daytime, is also highly sensitive to low light intensities during the night.""
  - ""The opposite direction that we observed between MEL and cell proliferation in our birds is different from the beneficial effect of MEL on neurogenesis and neuronal survival that was found in other nocturnal species [e.g. [21][22][23]67], although in both groups MEL exhibits the same circadian pattern.""",,"- The paper provides detailed information about the measurement of melatonin levels using radioimmunoassay, which is a method for quantifying melatonin concentrations.
- The results of the melatonin measurements are summarized in Figure 5, which is explicitly mentioned as the source for the melatonin data.
- The paper does not mention any tables as a source for the melatonin data, nor does it provide any page numbers for text-based data sources.
- The focus is on Figure 5 as the primary source for the detailed reporting of melatonin values."
Bright light at night alters the perception of daylength in Indian weaver bird (Ploceus philippinus),"Jayant Kumar, Shalie Malik, Sanjay Kumar Bhardwaj, Sangeeta Rani",-,-,Journal of Experimental Zoology Part A Ecological and Integrative Physiology,17,2018,Kumar_2018.pdf,Figures 1 and 2,"  - ""The effects of bright light at night on behavioral (locomotor activity)

and physiological responses (melatonin and body temperature rhythm) are shown in Figures 1 and 2""
  - ""The plasma melatonin showed rhythmic expression under both control and entire bright night (control: F 3,12 = 14.15, P = 0.0003; entire night group: one-way RM ANOVA; Figure 2g""
  - ""Though the melatonin secretion pattern in early, late, and midnight groups was affected by bright light at night, the total melatonin output in 24 hr day/night, 16 hr only night, or in 4 hr bright night was not different (Figure 2f""
  - ""The amplitude of melatonin was high in early-and late-night groups but was low in entire night and midnight groups.""
  - ""The bright light at night affected plasma melatonin rhythm by changing its amplitude. In entire night group (pattern A), melatonin rhythm was of low amplitude but, in other groups (pattern B), the phases of bright night altered the shape of melatonin rhythm, for example, its peak was shifted toward right (early-night group), or left (late-night group), or had two peaks (mid-night group).""",,"- The paper provides detailed information on the effects of bright light at night on melatonin levels in the Indian weaver bird.
- The most detailed reporting of melatonin values is found in Figures 1 and 2, as indicated by the text.
- Specifically, Figure 2g shows the rhythmic expression of plasma melatonin under different light conditions.
- Figure 2f provides information on the total melatonin output in different groups.
- The text also describes changes in melatonin amplitude and rhythm in response to bright light at night, but these are referenced to Figures 1 and 2."
Can skyglow reduce nocturnal melatonin concentrations in Eurasian perch? *,"Franziska Kupprat, Franz H € Olker, Werner Kloas, Sarah Harmon",-,-,Environmental Pollution,39,2020,Kupprat_2020.pdf,"- Text: Page numbers where melatonin data is described
- Figures: Fig. 1, Fig. 2, Fig. 3
- Tables: Table 1, Table 2","  - ""After ten days of exposure to the experimental conditions, tank water was noninvasively sampled every 3 h over a 24 h period and melatonin was measured by ELISA.""
  - ""Melatonin concentrations were determined in duplicates according to manufacturer's protocol with a commercially available ELISA kit (Melatonin Saliva ELISA, IBL, Hamburg, Germany).""
  - ""Melatonin concentrations decreased during bright daylight hours and increased during night conditions with a significant time effect dependent on the treatment (LLR ¼ 37.58, p < 0.0001, Table 1 , Fig. 1""
  - ""The melatonin concentrations were normalized to 1 L tank water and 1 kg fish biomass.""
  - ""For analysis of rhythmic parameters a non-linear regression using the single-component cosine analysis was applied on the relative melatonin data (Fig. 2""
  - ""Best-fit values (95% confidence intervals) of the non-linear regression using the single-component cosine analysis (Equation ( 1)) for relative amplitudes and periods of daily melatonin rhythms in the tank water of Eurasian perch under control conditions with dark nights (0 lx) and three different nocturnal light intensities. The fits are graphically displayed in Fig. 2 melatonin concentrations were significantly lowered in the tank water compared to the controls with dark nights.""
  - ""melatonin concentrations were added up for the night from 11 p.m. to 8 a.m. and for the day from 11 a.m. to 8 p.m. (Fig. 3""
  - ""The melatonin measured from the water samples decreased gradually with increasing ALAN intensities.""
  - ""The results in this study are overall consistent with the findings in an earlier study from the same setup with a strong suppression of melatonin at 1 lx compared to control levels and a rhythmic pattern at 1 lx to some extent (Brüning et al., 2015).""","  - ""(Page 4, Table 1) Below is a rendering of the page up to the first error.```\n|                                              | LLR  | p-value | R² marginal | R² conditional |\n|----------------------------------------------|------|---------|-------------|----------------|""
  - ""(Page 5, Table 1) | Initial values | Amplitude (%)         | Period (h)           |\n|----------------|-----------------------|----------------------|\n|                | 100                   | 24                   |""","- The paper describes an experiment where melatonin levels were measured in tank water using ELISA kits, indicating that the data source is primarily from these measurements.
- The melatonin concentrations were analyzed and presented in various forms, including absolute and relative concentrations, which are detailed in the text and figures.
- The paper references specific figures (Fig. 1, Fig. 2, Fig. 3) that display the melatonin data, indicating these figures are primary sources of the data.
- The tables (Table 1, Table 2) are mentioned as containing detailed results of the LMM analyses and rhythmic parameters, which are crucial for understanding the effects of ALAN on melatonin levels.
- The text provides detailed descriptions of how the melatonin data was collected, analyzed, and interpreted, making it a significant source of information."
"Differential response of diurnal and nocturnal mammals to prolonged altered light-dark cycle: a possible role of mood associated endocrine, inflammatory and antioxidant system","Ruchika Kumari, Vivek Verma, Noga Kronfeld-Schor, Muniyandi Singaravel",-,-,Chronobiology International,12,2021,Kumari_2021.pdf,"- Text: Page 1 (Abstract), Page 2 (Body)
- Table:","  - ""The results show that in diurnal squirrels, prolonged constant darkness reduced sucrose preference, CAT, and SOD, increased corticosterone and TNF-α levels, but caused no significant change in the melatonin compared to LD condition.""
  - ""In contrast, in nocturnal mice constant darkness caused no significant changes in sucrose preference and corticosterone levels, increased melatonin, CAT and SOD levels but decreased TNF-α levels.""
  - ""Chronic LL caused a similar response in both squirrels and mice: it decreased sucrose preference, melatonin, CAT and SOD levels but increased corticosterone and TNF-α levels.""
  - ""Prolonged exposure of squirrels to darkness did not produce a significant change in the serum melatonin concentration when compared to the LD group""
  - ""In mice, DD causes a significant increase in serum melatonin levels compared to LD""
  - ""The fact that constant light resulted in decreased melatonin levels in both squirrels and mice is not surprising, since melatonin is secreted during the night in both diurnal and nocturnal species, and light is a potent inhibitor of its secretion""
  - ""The increase in serum melatonin concentration in mice during constant darkness was somewhat unexpected, and may be attributed to the unnatural standard laboratory condition where the mice are held without a shelter, exposed to direct light during daytime.""
  - ""ELISA was performed to measure melatonin (Elabscience, USA, catalog no. E-ELM0788) and corticosterone (Gbiosciences, USA, catalog no. IT5614) levels in serum and to measure TNF-α (Elabscience, USA Catalog No. E-EL-M0049) in serum and hippocampus following manufacturer's instruction""
  - ""The concentration of melatonin, corticosterone and TNF-α is presented in pg/ml, ng/ml, and pg/mg protein, respectively.""","  - ""(Page 8, Table 1) | Species   | Mice          |            | Squirrels     |            |\n|-----------|---------------|------------|---------------|------------|\n| Treatment | DD            | LL         | DD            | LL         |""","- The paper discusses the effects of constant light and darkness on melatonin levels in both diurnal squirrels and nocturnal mice.
- The abstract and body of the paper provide detailed descriptions of how melatonin levels change under different light conditions.
- The paper mentions that melatonin levels were measured using ELISA, indicating that the data is based on experimental results.
- The table at the end of the paper (page 8) likely summarizes the findings, including changes in melatonin levels under different conditions.
- The detailed reporting of melatonin values is likely found in the text descriptions and possibly summarized in the table."
LIGHT AT NIGHT CANNOT SUPPRESS PINEAL MELATONIN LEVELS IN THE LIZARD ANOLZS CAROLZNENSZS,Herbert Underwcod,-,-,-,-,-,Underwood_1986.pdf,"Not mentioned (the paper does not specify a data source such as figures, tables, or page numbers for the melatonin data)","  - ""The present study was undertaken to discriminate between these two possibilities by observing the effects of high intensity (natural and artificial) light pulses on night time pineal melatonin levels in Anolis.""
  - ""On day 30 half of the lizards were exposed to direct sunlight from 2 to 3 p.m. (average intensity 27,250 lux) and the other half remained in the boxes in the dark (dark controls).""
  - ""On day 14 half of the lizards were exposed to sunlight from 2 to 4p.m.""
  - ""On day 22 (23 August) half of the lizards were exposed to 24,100 lux of fluorescent plus incandescent illumination from 2 to 4 p.m. while the other half remained in the dark.""
  - ""All lizards were killed at 3 p.m. and the pineals were removed, placed in chilled PBS buffer, stored at -20°C and subsequently assayed for melatonin via RIA as described previously (Underwood et al., 1984).""
  - ""Groups of sun-exposed and dark control anoles were killed at 3 p.m. and 4 p.m. and melatonin levels were subsequently assayed.""",,"- The paper discusses experiments conducted to observe the effects of high intensity natural and artificial light on pineal melatonin levels in Anolis lizards.
- The experiments involved exposing lizards to different light conditions and then measuring melatonin levels.
- The melatonin levels were assayed using RIA (Radioimmunoassay), as mentioned in the paper.
- The data on melatonin levels are likely reported in the text as part of the experimental results, but specific figures or tables are not mentioned in the provided text.
- The paper does not specify any particular figure or table numbers for the data, nor does it provide a page number for the detailed reporting of melatonin values."
"Persistence of a plasma melatonin rhythm in constant darkness and its inhibition by constant light in the sleepy lizard, Tiliqua rugosa","Bruce T Firth, Ingrid Belan, David J Kennaway",-,-,Journal of Pineal Research,11,2006,Firth_2006.pdf,"Figures 1, 2, 3, 4","  - ""In Experiment 1, lizards exposed to 12L:12D and constant 33°C in the austral spring displayed a significant rhythm of plasma melatonin. Furthermore, after 3 and 6 days of DD, there was also a significant melatonin rhythm (Fig. 1""
  - ""In lizards acclimated to comparable conditions to Experiment 1, but with only 5 days exposure to DD in autumn, there was a significant rhythm of melatonin production at the end of the 5 days (P < 0.05) (Experiment 2, Fig. 2""
  - ""Fig. 4 . Blood plasma melatonin rhythm of lizards (n ¼ 6-8) after being held in 33°C and 12L:12D for 6 days (A) followed by 3 days in LL (B).""
  - ""When a more sensitive RIA was used, there was a relatively high amplitude melatonin rhythm in 12L:12D and constant 33°C (Experiment 4, Fig. 4 ). However, when the lizards were subjected to LL for 3 days, the nocturnal melatonin levels dropped dramatically and were significantly lower (P < 0.001) than in 12L:12D, indicating that LL inhibited nighttime melatonin levels over 3 days.""
  - ""When lizards were subjected to a temperature lower (25°C) than their normally selected daytime activity temperature (33°C), a melatonin rhythm was still expressed (P < 0.05). The rhythm at 25°C, however, was not significantly different from that at 33°C (P > 0.05) (Experiment 3, Fig. 3""",,"- The paper provides detailed information on the effect of artificial light at night on melatonin levels in animals through several experiments.
- Experiment 1 is described with reference to Figure 1, which likely contains data on melatonin rhythms in constant darkness.
- Experiment 2 is associated with Figure 2, which shows melatonin production in constant darkness.
- Experiment 3 is linked to Figure 3, which displays melatonin rhythms at different temperatures.
- Experiment 4 is detailed in Figure 4, which specifically addresses the effect of constant light on melatonin levels, making it a primary source for the effect of artificial light at night.
- The figures mentioned are the main sources of detailed reporting on melatonin values and their response to light conditions."
Role of light wavelengths in synchronization of circadian physiology in songbirds,"G Yadav, S Malik, S Rani, V Kumar",-,-,Physiology and Behavior,21,2015,Yadav_2015.pdf,"Figure 3, Page 5 (text)","  - ""On exposure to spectral regimes, 12 h red component had significantly higher melatonin levels than the 12 h blue component, if the light regimes were presented as B:R (bunting; group 1: t = 2.157, Df = 5, P = 0.0417; group 2: t = 3.082, Df = 5, P = 0.0274, Indian weaver bird; group 1: t = 2.007, Df = 6, P = 0.0458, group 2: t = 3.699, Df = 5, P = 0.0140; Student's t-test; Fig. 3c and d′""
  - ""There was no significant correlation of activity with plasma melatonin levels in blackheaded buntings (group 1; melatonin: r = -0.3236, r 2 = 0.1047, P = 0.0811; Fig. 5a , group 2; melatonin: r = -0.2033, r 2 = 0.04134, P = 0.2812, Fig. 5a′ ). But, activity had significant negative correlation with plasma melatonin levels in Indian weaver birds (group 1; melatonin: r = -0.6276, r 2 = 0.3939, P = 0.0001; Fig. 5b , group 2; melatonin: r = -0.6640, r 2 = 0.4409, P b 0.0001; Fig. 5b′""
  - ""In both species, plasma melatonin levels were low during the day and significantly high at night, consistent with diurnal pattern of melatonin secretion (ZT6 vs. ZT18: bunting: t = 2.450, Df = 6, P b 0.05; Indian weaver bird: t = 8.867, Df = 6, P b 0.0001; Student t-test; Fig. 3a""
  - ""Plasma melatonin concentration (pg/ml) was measured by ELISA using a specific melatonin kit (product no. RE54021, IBL International GmbH, Hamburg, Germany), previously standardized and used in our laboratory for the measurement of melatonin in weaverbirds' samples [30].""","  - ""(Page 5, Table 1) |                         | Light conditions | Period (τ, h; mean ± SEM) of activity rhythm |                          |\n|-------------------------|------------------|----------------------------------------------|--------------------------|\n|                         |                  | Blackheaded bunting                          | Indian weaver bird       |""","- The paper provides detailed information on melatonin levels in response to different light wavelengths, which is the focus of the question.
- The melatonin data is primarily discussed in the text, particularly in the sections describing the effects of light wavelengths on melatonin levels.
- Figure 3 is specifically mentioned as showing the diurnal pattern of melatonin secretion and the effects of different light regimes on melatonin levels.
- The table on page 5 provides additional data on the circadian period under different light conditions, which may indirectly relate to melatonin secretion but is not the primary source for melatonin data.
- The main source of detailed reporting on melatonin values is the text and Figure 3."
"Studies on Pineal Melatonin Levels in a Diurnal Species, the Eastern Chipmunk (Tamias striatus): Effects of Light at Night, Propranolol Administration or Superior Cervical Ganglionectomy","R J Reiter, T S King, B A Richardson, E C Hurlbut",-,-,Journal of neural transmission,15,2005,Reiter_1982.pdf,"Figures 1, 2, 3, 4, 5","  - ""Pineals were dissected and frozen immediately for later hormone analyses.""
  - ""Melatonin assay and data analysis. Within 1 wk of tissue collection, pineal melatonin levels were estimated in individual glands using the radioimmu-noassay procedure of Rollag and Niswender (1976)""
  - ""Data were statistically analyzed using an ANOVA followed by a Student's t-test or by the Student-Newman-Kuets test where appropriate.""
  - ""Experiment 1. Regardless of whether chipmunks were exposed to darkness at night or whether the light phase was extended into the normal dark period, pineal levels of melatonin exhibited highly significant increases (Fig. 1 ) at both 2 a.m. and 4 a.m.""
  - ""Experiment 2. Chipmunks killed at midnight had highly significant increases in pineal melatonin content compared to those in glands collected at 8 p.m., the time at which the lights were turned off (Fig. 2""
  - ""Experiment 3. Chipmunks did not tolerate the combination of methoxyflurane anesthesia and SCGX well. The bulk of these animals died within the first 24 hours after the operation. This result- (Fig. 3""
  - ""Experiment 4. When chipmunks were acutely exposed to light at midnight pineal melatonin levels dropped very slowly (Fig. 4""
  - ""Experiment 5. In contrast to the response to light at midnight, when chipmunks were exposed to the same intensity light at 3 a.m. pineal melatonin levels dropped rapidly. Within 15 rain daytime levels of melatonin were already achieved (Fig. 5""",,"- The paper describes experiments where melatonin levels were measured using a radioimmunoassay procedure, indicating that the data source is primarily the results of these experiments.
- The paper refers to figures (Fig. 1, Fig. 2, Fig. 3, Fig. 4, Fig. 5) which are likely to contain detailed data on melatonin levels in response to different conditions.
- The text does not mention any tables or specific page numbers for data reporting, suggesting that the figures are the primary source of detailed data."